{
  "schema_version": "1.0.0",
  "category": "reading",
  "suggested_title": "Reading recommendations",
  "summary": "Two titles were saved for reading later.",
  "summary_evidence": [
    {
      "observation_id": "11111111-1111-4111-8111-111111111111",
      "start": 0,
      "end": 39,
      "quote": "Read later: Sky Archive; River Pilgrim."
    }
  ],
  "entities": [
    {
      "local_id": "e1",
      "name": "Sky Archive",
      "type": "book",
      "intent": "read_later",
      "evidence": [
        {
          "observation_id": "11111111-1111-4111-8111-111111111111",
          "start": 12,
          "end": 23,
          "quote": "Sky Archive"
        }
      ]
    },
    {
      "local_id": "e2",
      "name": "River Pilgrim",
      "type": "book",
      "intent": "read_later",
      "evidence": [
        {
          "observation_id": "11111111-1111-4111-8111-111111111111",
          "start": 25,
          "end": 38,
          "quote": "River Pilgrim"
        }
      ]
    }
  ],
  "claims": [],
  "actions": [],
  "needs_review": []
}
